asset_id,ip_address,port,protocol_id,title,vulnerability_id,nexpose_id,references,severity_score,pci_severity_score,cvss_score,cvss_vector,vendor,name,version
18,10.0.2.15,-1,-1,Microsoft CVE-2017-11815: Windows SMB Information Disclosure Vulnerability,70208,msft-cve-2017-11815,<CVE:CVE-2017-11815><MSKB:4041676><MSKB:4041678><MSKB:4041679><MSKB:4041681><MSKB:4041687><MSKB:4041689><MSKB:4041690><MSKB:4041691><MSKB:4041693><MSKB:4041995><MSKB:4042895>,4,2,5.3,AV:N/AC:M/Au:S/C:P/I:N/A:N,Microsoft,Windows 7 Professional Edition,SP1
18,10.0.2.15,-1,-1,Microsoft CVE-2017-11816: Windows GDI Information Disclosure Vulnerability,70206,msft-cve-2017-11816,<CVE:CVE-2017-11816><MSKB:4041676><MSKB:4041678><MSKB:4041679><MSKB:4041681><MSKB:4041687><MSKB:4041689><MSKB:4041690><MSKB:4041691><MSKB:4041693><MSKB:4042121><MSKB:4042895>,2,2,5.5,AV:L/AC:L/Au:N/C:P/I:N/A:N,Microsoft,Windows 7 Professional Edition,SP1
18,10.0.2.15,-1,-1,Microsoft CVE-2017-11817: Windows Kernel Information Disclosure Vulnerability,70211,msft-cve-2017-11817,<CVE:CVE-2017-11817><MSKB:4041676><MSKB:4041678><MSKB:4041679><MSKB:4041681><MSKB:4041687><MSKB:4041689><MSKB:4041690><MSKB:4041691><MSKB:4041693><MSKB:4041944><MSKB:4042895>,2,1,4.7,AV:L/AC:M/Au:N/C:P/I:N/A:N,Microsoft,Windows 7 Professional Edition,SP1
18,10.0.2.15,-1,-1,Microsoft CVE-2017-11819: Windows Shell Remote Code Execution Vulnerability,70213,msft-cve-2017-11819,<CVE:CVE-2017-11819><MSKB:4041678><MSKB:4041681>,8,5,7.5,AV:N/AC:H/Au:N/C:C/I:C/A:C,Microsoft,Windows 7 Professional Edition,SP1
18,10.0.2.15,-1,-1,Microsoft CVE-2017-11824: Windows Graphics Component Elevation of Privilege Vulnerability,70180,msft-cve-2017-11824,<CVE:CVE-2017-11824><MSKB:4041676><MSKB:4041678><MSKB:4041679><MSKB:4041681><MSKB:4041687><MSKB:4041689><MSKB:4041690><MSKB:4041691><MSKB:4041693><MSKB:4042120><MSKB:4042895>,7,4,7.0,AV:L/AC:M/Au:N/C:C/I:C/A:C,Microsoft,Windows 7 Professional Edition,SP1
18,10.0.2.15,-1,-1,Microsoft CVE-2017-11831: Windows Kernel Information Disclosure Vulnerability,70233,msft-cve-2017-11831,<CVE:CVE-2017-11831><MSKB:4046184><MSKB:4048952><MSKB:4048953><MSKB:4048954><MSKB:4048955><MSKB:4048956><MSKB:4048957><MSKB:4048958><MSKB:4048959><MSKB:4048960><MSKB:4048961><MSKB:4048962>,5,3,4.7,AV:L/AC:M/Au:N/C:C/I:N/A:N,Microsoft,Windows 7 Professional Edition,SP1
18,10.0.2.15,-1,-1,Microsoft CVE-2017-11832: Windows EOT Font Engine Information Disclosure Vulnerability,70232,msft-cve-2017-11832,<CVE:CVE-2017-11832><MSKB:4048957><MSKB:4048959><MSKB:4048960><MSKB:4048962><MSKB:4048968>,2,1,4.7,AV:L/AC:M/Au:N/C:P/I:N/A:N,Microsoft,Windows 7 Professional Edition,SP1
18,10.0.2.15,-1,-1,Microsoft CVE-2017-11835: Windows EOT Font Engine Information Disclosure Vulnerability,70237,msft-cve-2017-11835,<CVE:CVE-2017-11835><MSKB:4048957><MSKB:4048960><MSKB:4048968>,2,2,5.5,AV:L/AC:L/Au:N/C:P/I:N/A:N,Microsoft,Windows 7 Professional Edition,SP1
18,10.0.2.15,-1,-1,Microsoft CVE-2017-11847: Windows Kernel Elevation of Privilege Vulnerability,70224,msft-cve-2017-11847,<CVE:CVE-2017-11847><MSKB:4048952><MSKB:4048953><MSKB:4048954><MSKB:4048955><MSKB:4048956><MSKB:4048957><MSKB:4048958><MSKB:4048959><MSKB:4048960><MSKB:4048961><MSKB:4048962><MSKB:4048970>,9,5,7.8,AV:N/AC:M/Au:N/C:C/I:C/A:C,Microsoft,Windows 7 Professional Edition,SP1
18,10.0.2.15,-1,-1,Microsoft CVE-2017-11849: Windows Kernel Information Disclosure Vulnerability,70226,msft-cve-2017-11849,<CVE:CVE-2017-11849><MSKB:4048952><MSKB:4048953><MSKB:4048954><MSKB:4048955><MSKB:4048956><MSKB:4048957><MSKB:4048958><MSKB:4048959><MSKB:4048960><MSKB:4048961><MSKB:4048962><MSKB:4048970>,2,1,4.7,AV:L/AC:M/Au:N/C:P/I:N/A:N,Microsoft,Windows 7 Professional Edition,SP1
18,10.0.2.15,-1,-1,Microsoft CVE-2017-11851: Windows GDI Information Disclosure Vulnerability,70219,msft-cve-2017-11851,<CVE:CVE-2017-11851><MSKB:4048952><MSKB:4048953><MSKB:4048954><MSKB:4048955><MSKB:4048956><MSKB:4048957><MSKB:4048958><MSKB:4048959><MSKB:4048960><MSKB:4048961><MSKB:4048962><MSKB:4048970>,2,1,4.7,AV:L/AC:M/Au:N/C:P/I:N/A:N,Microsoft,Windows 7 Professional Edition,SP1
18,10.0.2.15,-1,-1,Microsoft CVE-2017-11852: Windows GDI Information Disclosure Vulnerability,70218,msft-cve-2017-11852,<CVE:CVE-2017-11852><MSKB:4048957><MSKB:4048960><MSKB:4048970>,2,1,4.7,AV:L/AC:M/Au:N/C:P/I:N/A:N,Microsoft,Windows 7 Professional Edition,SP1
18,10.0.2.15,-1,-1,Microsoft CVE-2017-11853: Windows Kernel Information Disclosure Vulnerability,69925,msft-cve-2017-11853,<CVE:CVE-2017-11853><MSKB:4048952><MSKB:4048953><MSKB:4048954><MSKB:4048955><MSKB:4048956><MSKB:4048957><MSKB:4048958><MSKB:4048959><MSKB:4048960><MSKB:4048961><MSKB:4048962><MSKB:4048970>,4,3,5.5,AV:N/AC:M/Au:N/C:P/I:N/A:N,Microsoft,Windows 7 Professional Edition,SP1
18,10.0.2.15,-1,-1,Microsoft CVE-2017-11880: Windows Kernel Information Disclosure Vulnerability,69970,msft-cve-2017-11880,<CVE:CVE-2017-11880><MSKB:4048952><MSKB:4048953><MSKB:4048954><MSKB:4048955><MSKB:4048956><MSKB:4048957><MSKB:4048958><MSKB:4048959><MSKB:4048960><MSKB:4048961><MSKB:4048962><MSKB:4049164>,2,1,4.7,AV:L/AC:M/Au:N/C:P/I:N/A:N,Microsoft,Windows 7 Professional Edition,SP1
18,10.0.2.15,-1,-1,Microsoft CVE-2017-11885: Windows RRAS Service Remote Code Execution Vulnerability,69972,msft-cve-2017-11885,<CVE:CVE-2017-11885><MSKB:4052303><MSKB:4053578><MSKB:4053579><MSKB:4053580><MSKB:4053581><MSKB:4054517><MSKB:4054518><MSKB:4054519><MSKB:4054520><MSKB:4054521><MSKB:4054522><MSKB:4054523>,9,5,6.6,AV:N/AC:M/Au:S/C:C/I:C/A:C,Microsoft,Windows 7 Professional Edition,SP1
18,10.0.2.15,-1,-1,Microsoft CVE-2017-11927: Microsoft Windows Information Disclosure Vulnerability,67471,msft-cve-2017-11927,<CVE:CVE-2017-11927><MSKB:4053578><MSKB:4103712><MSKB:4103715><MSKB:4103716><MSKB:4103718><MSKB:4103723><MSKB:4103725><MSKB:4103726><MSKB:4103727><MSKB:4103730><MSKB:4103731><MSKB:4130957>,4,3,6.5,AV:N/AC:M/Au:N/C:P/I:N/A:N,Microsoft,Windows 7 Professional Edition,SP1
18,10.0.2.15,-1,-1,Microsoft CVE-2017-11937: Malware Protection Engine Remote Code Execution Vulnerability,67545,msft-cve-2017-11937,<CVE:CVE-2017-11937>,9,5,7.8,AV:N/AC:M/Au:N/C:C/I:C/A:C,Microsoft,Windows 7 Professional Edition,SP1
18,10.0.2.15,-1,-1,Microsoft CVE-2017-11940: Malware Protection Engine Remote Code Execution Vulnerability,67535,msft-cve-2017-11940,<CVE:CVE-2017-11940>,9,5,7.8,AV:N/AC:M/Au:N/C:C/I:C/A:C,Microsoft,Windows 7 Professional Edition,SP1
18,10.0.2.15,-1,-1,Microsoft CVE-2017-13080: Windows Wireless WPA Group Key Reinstallation Vulnerability,95992,msft-cve-2017-13080,<CVE:CVE-2017-13080><MSKB:4041676><MSKB:4041678><MSKB:4041679><MSKB:4041681><MSKB:4041687><MSKB:4041689><MSKB:4041690><MSKB:4041691><MSKB:4041693><MSKB:4042723><MSKB:4042895>,3,2,5.3,AV:A/AC:M/Au:N/C:N/I:P/A:N,Microsoft,Windows 7 Professional Edition,SP1
18,10.0.2.15,-1,-1,Microsoft CVE-2017-5715: Guidance to mitigate speculative execution side-channel vulnerabilities,55476,msft-cve-2017-5715,<CVE:CVE-2017-5715><MSKB:4056888><MSKB:4057113><MSKB:4057114><MSKB:4057115><MSKB:4057116><MSKB:4057117><MSKB:4057118><MSKB:4057120><MSKB:4057121><MSKB:4057122><MSKB:4058559><MSKB:4058560><MSKB:4058561><MSKB:4058562><MSKB:4074590><MSKB:4074591><MSKB:4088776><MSKB:4088779><MSKB:4088782><MSKB:4088786><MSKB:4088787><MSKB:4088875><MSKB:4088876><MSKB:4088877><MSKB:4088878><MSKB:4089187><MSKB:4093112><MSKB:4103723><MSKB:4284826><MSKB:4284860><MSKB:4284867><MSKB:4284874><MSKB:4338815><MSKB:4338820><MSKB:4338824><MSKB:4338830><MSKB:4340583><MSKB:4457128><MSKB:4467708><MSKB:4493446><MSKB:4493448><MSKB:4493464><MSKB:4493467><MSKB:4493472><URL:https://portal.msrc.microsoft.com/en-US/security-guidance/advisory/ADV180002>,5,3,5.6,AV:L/AC:M/Au:N/C:C/I:N/A:N,Microsoft,Windows 7 Professional Edition,SP1
18,10.0.2.15,-1,-1,Microsoft CVE-2017-5754: Guidance to mitigate speculative execution side-channel vulnerabilities,55392,msft-cve-2017-5754,<CVE:CVE-2017-5754><MSKB:4056888><MSKB:4057113><MSKB:4057114><MSKB:4057115><MSKB:4057116><MSKB:4057117><MSKB:4057118><MSKB:4057120><MSKB:4057121><MSKB:4057122><MSKB:4058559><MSKB:4058560><MSKB:4058561><MSKB:4058562><MSKB:4074590><MSKB:4074591><MSKB:4088776><MSKB:4088779><MSKB:4088782><MSKB:4088786><MSKB:4088787><MSKB:4088875><MSKB:4088876><MSKB:4088877><MSKB:4088878><MSKB:4089187><MSKB:4093112><MSKB:4103723><MSKB:4284826><MSKB:4284860><MSKB:4284867><MSKB:4284874><MSKB:4338815><MSKB:4338820><MSKB:4338824><MSKB:4338830><MSKB:4340583><MSKB:4457128><MSKB:4467708><MSKB:4493446><MSKB:4493448><MSKB:4493464><MSKB:4493467><MSKB:4493472><URL:https://portal.msrc.microsoft.com/en-US/security-guidance/advisory/ADV180002>,5,3,5.6,AV:L/AC:M/Au:N/C:C/I:N/A:N,Microsoft,Windows 7 Professional Edition,SP1
18,10.0.2.15,-1,-1,Microsoft CVE-2017-8463: Windows Explorer Remote Code Execution Vulnerability,102367,msft-cve-2017-8463,<CVE:CVE-2017-8463><MSKB:4025331><MSKB:4025333><MSKB:4025336><MSKB:4025337><MSKB:4025338><MSKB:4025339><MSKB:4025341><MSKB:4025342><MSKB:4025343><MSKB:4025344><MSKB:4025497>,9,5,7.8,AV:N/AC:M/Au:N/C:C/I:C/A:C,Microsoft,Windows 7 Professional Edition,SP1
18,10.0.2.15,-1,-1,Microsoft CVE-2017-8467: Win32k Elevation of Privilege Vulnerability,102348,msft-cve-2017-8467,<CVE:CVE-2017-8467><MSKB:4025331><MSKB:4025333><MSKB:4025336><MSKB:4025337><MSKB:4025338><MSKB:4025339><MSKB:4025341><MSKB:4025342><MSKB:4025343><MSKB:4025344><MSKB:4025877>,7,4,7.0,AV:L/AC:M/Au:N/C:C/I:C/A:C,Microsoft,Windows 7 Professional Edition,SP1
18,10.0.2.15,-1,-1,Microsoft CVE-2017-8486: Win32k Information Disclosure Vulnerability,102176,msft-cve-2017-8486,<CVE:CVE-2017-8486><MSKB:4025331><MSKB:4025333><MSKB:4025336><MSKB:4025337><MSKB:4025338><MSKB:4025339><MSKB:4025341><MSKB:4025342><MSKB:4025343><MSKB:4025344><MSKB:4025877>,2,1,4.7,AV:L/AC:M/Au:N/C:P/I:N/A:N,Microsoft,Windows 7 Professional Edition,SP1
18,10.0.2.15,-1,-1,Microsoft CVE-2017-8495: Kerberos SNAME Security Feature Bypass Vulnerability,102143,msft-cve-2017-8495,<CVE:CVE-2017-8495><MSKB:4022746><MSKB:4025331><MSKB:4025333><MSKB:4025336><MSKB:4025337><MSKB:4025338><MSKB:4025339><MSKB:4025341><MSKB:4025342><MSKB:4025343><MSKB:4025344>,6,4,7.5,AV:N/AC:M/Au:S/C:P/I:P/A:P,Microsoft,Windows 7 Professional Edition,SP1
18,10.0.2.15,-1,-1,Microsoft CVE-2017-8533: Windows GDI Information Disclosure Vulnerability,76514,msft-cve-2017-8533,<CVE:CVE-2017-8533><MSKB:3191837><MSKB:3191844><MSKB:4022714><MSKB:4022715><MSKB:4022717><MSKB:4022718><MSKB:4022719><MSKB:4022722><MSKB:4022724><MSKB:4022725><MSKB:4022726><MSKB:4022727><MSKB:4022884><MSKB:4503269><MSKB:4503292>,4,3,6.5,AV:N/AC:M/Au:N/C:P/I:N/A:N,Microsoft,Windows 7 Professional Edition,SP1
18,10.0.2.15,-1,-1,Microsoft CVE-2017-8535: Microsoft Malware Protection Engine Denial of Service Vulnerability,76512,msft-cve-2017-8535,<CVE:CVE-2017-8535><URL:https://bugs.chromium.org/p/project-zero/issues/detail?id=1260>,4,2,5.5,AV:N/AC:M/Au:N/C:N/I:N/A:P,Microsoft,Windows 7 Professional Edition,SP1
18,10.0.2.15,-1,-1,Microsoft CVE-2017-8536: Microsoft Malware Protection Engine Denial of Service Vulnerability,76519,msft-cve-2017-8536,<CVE:CVE-2017-8536><URL:https://bugs.chromium.org/p/project-zero/issues/detail?id=1260>,4,2,5.5,AV:N/AC:M/Au:N/C:N/I:N/A:P,Microsoft,Windows 7 Professional Edition,SP1
18,10.0.2.15,-1,-1,Microsoft CVE-2017-8537: Microsoft Malware Protection Engine Denial of Service Vulnerability,76521,msft-cve-2017-8537,<CVE:CVE-2017-8537><URL:https://bugs.chromium.org/p/project-zero/issues/detail?id=1260>,4,2,5.5,AV:N/AC:M/Au:N/C:N/I:N/A:P,Microsoft,Windows 7 Professional Edition,SP1
18,10.0.2.15,-1,-1,Microsoft CVE-2017-8538: Microsoft Malware Protection Engine Remote Code Execution Vulnerability,76516,msft-cve-2017-8538,<CVE:CVE-2017-8538><URL:https://bugs.chromium.org/p/project-zero/issues/detail?id=1260>,9,5,7.8,AV:N/AC:M/Au:N/C:C/I:C/A:C,Microsoft,Windows 7 Professional Edition,SP1
18,10.0.2.15,-1,-1,Microsoft CVE-2017-8539: Microsoft Malware Protection Engine Denial of Service Vulnerability,76517,msft-cve-2017-8539,<CVE:CVE-2017-8539><URL:https://bugs.chromium.org/p/project-zero/issues/detail?id=1260>,4,2,5.5,AV:N/AC:M/Au:N/C:N/I:N/A:P,Microsoft,Windows 7 Professional Edition,SP1
18,10.0.2.15,-1,-1,Microsoft CVE-2017-8540 Microsoft Malware Protection Engine Remote Code Execution Vulnerability,76646,msft-cve-2017-8540,<CVE:CVE-2017-8540><URL:https://bugs.chromium.org/p/project-zero/issues/detail?id=1260>,9,5,7.8,AV:N/AC:M/Au:N/C:C/I:C/A:C,Microsoft,Windows 7 Professional Edition,SP1
18,10.0.2.15,-1,-1,Microsoft CVE-2017-8541: Microsoft Malware Protection Engine Remote Code Execution Vulnerability,76643,msft-cve-2017-8541,<CVE:CVE-2017-8541><URL:https://bugs.chromium.org/p/project-zero/issues/detail?id=1260>,9,5,7.8,AV:N/AC:M/Au:N/C:C/I:C/A:C,Microsoft,Windows 7 Professional Edition,SP1
18,10.0.2.15,-1,-1,Microsoft CVE-2017-8542: Microsoft Malware Protection Engine Denial of Service Vulnerability,76644,msft-cve-2017-8542,<CVE:CVE-2017-8542><URL:https://bugs.chromium.org/p/project-zero/issues/detail?id=1260>,4,2,5.5,AV:N/AC:M/Au:N/C:N/I:N/A:P,Microsoft,Windows 7 Professional Edition,SP1
18,10.0.2.15,-1,-1,Microsoft CVE-2017-8552: Windows Graphics Component Elevation of Privilege Vulnerability,76601,msft-cve-2017-8552,<CVE:CVE-2017-8552><MSKB:4019204><MSKB:4019263><MSKB:4019264>,7,5,7.8,AV:L/AC:L/Au:N/C:C/I:C/A:C,Microsoft,Windows 7 Professional Edition,SP1
18,10.0.2.15,-1,-1,Microsoft CVE-2017-8556: Win32k Elevation of Privilege Vulnerability,76593,msft-cve-2017-8556,<CVE:CVE-2017-8556><MSKB:4025331><MSKB:4025333><MSKB:4025336><MSKB:4025337><MSKB:4025338><MSKB:4025339><MSKB:4025341><MSKB:4025342><MSKB:4025343><MSKB:4025344><MSKB:4025877>,7,4,7.0,AV:L/AC:M/Au:N/C:C/I:C/A:C,Microsoft,Windows 7 Professional Edition,SP1
18,10.0.2.15,-1,-1,Microsoft CVE-2017-8557: Windows System Information Console Information Disclosure Vulnerability,76594,msft-cve-2017-8557,<CVE:CVE-2017-8557><MSKB:4025331><MSKB:4025333><MSKB:4025336><MSKB:4025337><MSKB:4025338><MSKB:4025339><MSKB:4025341><MSKB:4025342><MSKB:4025343><MSKB:4025344><MSKB:4025398>,2,2,5.5,AV:L/AC:L/Au:N/C:P/I:N/A:N,Microsoft,Windows 7 Professional Edition,SP1
18,10.0.2.15,-1,-1,Microsoft CVE-2017-8558: Malware Protection Engine Remote Code Execution Vulnerability,76599,msft-cve-2017-8558,<CVE:CVE-2017-8558>,9,5,7.8,AV:N/AC:M/Au:N/C:C/I:C/A:C,Microsoft,Windows 7 Professional Edition,SP1
18,10.0.2.15,-1,-1,Microsoft CVE-2017-8564: Windows Kernel Information Disclosure Vulnerability,76448,msft-cve-2017-8564,<CVE:CVE-2017-8564><MSKB:4022748><MSKB:4025331><MSKB:4025333><MSKB:4025336><MSKB:4025337><MSKB:4025338><MSKB:4025339><MSKB:4025341><MSKB:4025342><MSKB:4025343><MSKB:4025344>,2,2,5.5,AV:L/AC:L/Au:N/C:P/I:N/A:N,Microsoft,Windows 7 Professional Edition,SP1
18,10.0.2.15,-1,-1,Microsoft CVE-2017-8565: Windows PowerShell Remote Code Execution Vulnerability,76440,msft-cve-2017-8565,<CVE:CVE-2017-8565><MSKB:4025331><MSKB:4025333><MSKB:4025336><MSKB:4025337><MSKB:4025338><MSKB:4025339><MSKB:4025341><MSKB:4025342><MSKB:4025343><MSKB:4025344><MSKB:4025872>,9,5,8.1,AV:N/AC:M/Au:N/C:C/I:C/A:C,Microsoft,Windows 7 Professional Edition,SP1
18,10.0.2.15,-1,-1,Microsoft CVE-2017-8573: Win32k Elevation of Privilege Vulnerability,76430,msft-cve-2017-8573,<CVE:CVE-2017-8573><MSKB:4025331><MSKB:4025333><MSKB:4025336><MSKB:4025337><MSKB:4025338><MSKB:4025339><MSKB:4025341><MSKB:4025342><MSKB:4025343><MSKB:4025344><MSKB:4025877>,7,4,7.0,AV:L/AC:M/Au:N/C:C/I:C/A:C,Microsoft,Windows 7 Professional Edition,SP1
18,10.0.2.15,-1,-1,Microsoft CVE-2017-8577: Win32k Elevation of Privilege Vulnerability,76421,msft-cve-2017-8577,<CVE:CVE-2017-8577><MSKB:4025331><MSKB:4025333><MSKB:4025336><MSKB:4025337><MSKB:4025338><MSKB:4025339><MSKB:4025341><MSKB:4025342><MSKB:4025343><MSKB:4025344><MSKB:4025877>,7,4,7.0,AV:L/AC:M/Au:N/C:C/I:C/A:C,Microsoft,Windows 7 Professional Edition,SP1
18,10.0.2.15,-1,-1,Microsoft CVE-2017-8578: Win32k Elevation of Privilege Vulnerability,76416,msft-cve-2017-8578,<CVE:CVE-2017-8578><MSKB:4025331><MSKB:4025333><MSKB:4025336><MSKB:4025337><MSKB:4025338><MSKB:4025339><MSKB:4025341><MSKB:4025342><MSKB:4025343><MSKB:4025344><MSKB:4025877>,9,5,7.8,AV:N/AC:M/Au:N/C:C/I:C/A:C,Microsoft,Windows 7 Professional Edition,SP1
18,10.0.2.15,-1,-1,Microsoft CVE-2017-8580: Win32k Elevation of Privilege Vulnerability,76496,msft-cve-2017-8580,<CVE:CVE-2017-8580><MSKB:4025331><MSKB:4025333><MSKB:4025336><MSKB:4025337><MSKB:4025338><MSKB:4025339><MSKB:4025341><MSKB:4025342><MSKB:4025343><MSKB:4025344><MSKB:4025877>,6,4,7.0,AV:L/AC:H/Au:N/C:C/I:C/A:C,Microsoft,Windows 7 Professional Edition,SP1
18,10.0.2.15,-1,-1,Microsoft CVE-2017-8581: Win32k Elevation of Privilege Vulnerability,76493,msft-cve-2017-8581,<CVE:CVE-2017-8581><MSKB:4025331><MSKB:4025333><MSKB:4025336><MSKB:4025337><MSKB:4025338><MSKB:4025339><MSKB:4025341><MSKB:4025342><MSKB:4025343><MSKB:4025344><MSKB:4025877>,4,2,7.0,AV:L/AC:H/Au:N/C:P/I:P/A:P,Microsoft,Windows 7 Professional Edition,SP1
18,10.0.2.15,-1,-1,Microsoft CVE-2017-8582: Http.sys Information Disclosure Vulnerability,76494,msft-cve-2017-8582,<CVE:CVE-2017-8582><MSKB:4022914><MSKB:4025331><MSKB:4025333><MSKB:4025336><MSKB:4025337><MSKB:4025338><MSKB:4025339><MSKB:4025341><MSKB:4025342><MSKB:4025343><MSKB:4025344>,4,3,5.9,AV:N/AC:M/Au:N/C:P/I:N/A:N,Microsoft,Windows 7 Professional Edition,SP1
18,10.0.2.15,-1,-1,Microsoft CVE-2017-8587: Windows Explorer Denial of Service Vulnerability,76491,msft-cve-2017-8587,<CVE:CVE-2017-8587><MSKB:4025331><MSKB:4025333><MSKB:4025336><MSKB:4025337><MSKB:4025338><MSKB:4025341><MSKB:4025343><MSKB:4025344><MSKB:4025674>,4,2,6.5,AV:N/AC:M/Au:N/C:N/I:N/A:P,Microsoft,Windows 7 Professional Edition,SP1
18,10.0.2.15,-1,-1,Microsoft CVE-2017-8588: WordPad Remote Code Execution Vulnerability,76492,msft-cve-2017-8588,<CVE:CVE-2017-8588><MSKB:4025331><MSKB:4025333><MSKB:4025336><MSKB:4025337><MSKB:4025338><MSKB:4025339><MSKB:4025341><MSKB:4025342><MSKB:4025343><MSKB:4025344><MSKB:4026061>,8,5,7.0,AV:N/AC:H/Au:N/C:C/I:C/A:C,Microsoft,Windows 7 Professional Edition,SP1
18,10.0.2.15,-1,-1,Microsoft CVE-2017-8589: Windows Search Remote Code Execution Vulnerability,76489,msft-cve-2017-8589,<CVE:CVE-2017-8589><MSKB:4025331><MSKB:4025333><MSKB:4025336><MSKB:4025337><MSKB:4025338><MSKB:4025339><MSKB:4025341><MSKB:4025342><MSKB:4025343><MSKB:4025344><MSKB:4032955>,10,5,9.8,AV:N/AC:L/Au:N/C:C/I:C/A:C,Microsoft,Windows 7 Professional Edition,SP1
18,10.0.2.15,-1,-1,Microsoft CVE-2017-8590: Windows Common Log File System Driver Elevation of Privilege Vulnerability,76477,msft-cve-2017-8590,<CVE:CVE-2017-8590><MSKB:4025331><MSKB:4025333><MSKB:4025336><MSKB:4025337><MSKB:4025338><MSKB:4025339><MSKB:4025341><MSKB:4025342><MSKB:4025343><MSKB:4025344><MSKB:4026059>,5,3,8.8,AV:L/AC:L/Au:N/C:P/I:P/A:P,Microsoft,Windows 7 Professional Edition,SP1
18,10.0.2.15,-1,-1,Microsoft CVE-2017-8592: Microsoft Browser Security Feature Bypass Vulnerability,76474,msft-cve-2017-8592,<CVE:CVE-2017-8592><MSKB:4025240><MSKB:4025252><MSKB:4025331><MSKB:4025333><MSKB:4025336><MSKB:4025337><MSKB:4025338><MSKB:4025339><MSKB:4025341><MSKB:4025342><MSKB:4025343><MSKB:4025344>,4,3,6.5,AV:N/AC:M/Au:N/C:P/I:N/A:N,Microsoft,Windows 7 Professional Edition,SP1
18,10.0.2.15,-1,-1,Microsoft CVE-2017-8593: Win32k Elevation of Privilege Vulnerability,76475,msft-cve-2017-8593,<CVE:CVE-2017-8593><MSKB:4034658><MSKB:4034660><MSKB:4034664><MSKB:4034665><MSKB:4034666><MSKB:4034668><MSKB:4034672><MSKB:4034674><MSKB:4034679><MSKB:4034681><MSKB:4035055>,7,4,7.0,AV:L/AC:M/Au:N/C:C/I:C/A:C,Microsoft,Windows 7 Professional Edition,SP1
18,10.0.2.15,-1,-1,Microsoft CVE-2017-8620: Windows Search Remote Code Execution Vulnerability,77643,msft-cve-2017-8620,<CVE:CVE-2017-8620><MSKB:4034034><MSKB:4034658><MSKB:4034660><MSKB:4034664><MSKB:4034665><MSKB:4034666><MSKB:4034668><MSKB:4034672><MSKB:4034674><MSKB:4034679><MSKB:4034681>,9,5,8.1,AV:N/AC:M/Au:N/C:C/I:C/A:C,Microsoft,Windows 7 Professional Edition,SP1
18,10.0.2.15,-1,-1,Microsoft CVE-2017-8624: Windows Common Log File System Driver Elevation of Privilege Vulnerability,77647,msft-cve-2017-8624,<CVE:CVE-2017-8624><MSKB:4034658><MSKB:4034660><MSKB:4034664><MSKB:4034665><MSKB:4034666><MSKB:4034668><MSKB:4034672><MSKB:4034674><MSKB:4034679><MSKB:4034681><MSKB:4034745>,7,5,7.8,AV:L/AC:L/Au:N/C:C/I:C/A:C,Microsoft,Windows 7 Professional Edition,SP1
18,10.0.2.15,-1,-1,Microsoft CVE-2017-8628: Microsoft Bluetooth Driver Spoofing Vulnerability,77634,msft-cve-2017-8628,<CVE:CVE-2017-8628><MSKB:4025333><MSKB:4025337><MSKB:4034786><MSKB:4038777><MSKB:4038781><MSKB:4038782><MSKB:4038783><MSKB:4038788><MSKB:4038792>,4,3,6.8,AV:A/AC:M/Au:N/C:P/I:P/A:N,Microsoft,Windows 7 Professional Edition,SP1
18,10.0.2.15,-1,-1,Microsoft CVE-2017-8633: Windows Error Reporting Elevation of Privilege Vulnerability,77620,msft-cve-2017-8633,<CVE:CVE-2017-8633><MSKB:4034658><MSKB:4034660><MSKB:4034664><MSKB:4034665><MSKB:4034666><MSKB:4034668><MSKB:4034672><MSKB:4034674><MSKB:4034679><MSKB:4034681><MSKB:4035679>,9,5,7.5,AV:N/AC:M/Au:S/C:C/I:C/A:C,Microsoft,Windows 7 Professional Edition,SP1
18,10.0.2.15,-1,-1,Microsoft CVE-2017-8666: Win32k Information Disclosure Vulnerability,77534,msft-cve-2017-8666,<CVE:CVE-2017-8666><MSKB:4034658><MSKB:4034660><MSKB:4034664><MSKB:4034665><MSKB:4034666><MSKB:4034668><MSKB:4034672><MSKB:4034674><MSKB:4034679><MSKB:4034681><MSKB:4035055>,2,2,5.5,AV:L/AC:L/Au:N/C:P/I:N/A:N,Microsoft,Windows 7 Professional Edition,SP1
18,10.0.2.15,-1,-1,Microsoft CVE-2017-8668: Volume Manager Extension Driver Information Disclosure Vulnerability,77536,msft-cve-2017-8668,<CVE:CVE-2017-8668><MSKB:4034664><MSKB:4034665><MSKB:4034666><MSKB:4034672><MSKB:4034679><MSKB:4034681><MSKB:4034744>,2,2,5.5,AV:L/AC:L/Au:N/C:P/I:N/A:N,Microsoft,Windows 7 Professional Edition,SP1
18,10.0.2.15,-1,-1,Microsoft CVE-2017-8675: Win32k Elevation of Privilege Vulnerability,77495,msft-cve-2017-8675,<CVE:CVE-2017-8675><MSKB:4038777><MSKB:4038779><MSKB:4038781><MSKB:4038782><MSKB:4038783><MSKB:4038786><MSKB:4038788><MSKB:4038792><MSKB:4038793><MSKB:4038799><MSKB:4039384>,7,4,7.0,AV:L/AC:M/Au:N/C:C/I:C/A:C,Microsoft,Windows 7 Professional Edition,SP1
18,10.0.2.15,-1,-1,Microsoft CVE-2017-8676: Windows GDI+ Information Disclosure Vulnerability,77497,msft-cve-2017-8676,<CVE:CVE-2017-8676><MSKB:3212225><MSKB:3213638><MSKB:3213641><MSKB:4011040><MSKB:4011107><MSKB:4011134><MSKB:4025865><MSKB:4025866><MSKB:4025867><MSKB:4025868><MSKB:4025869><MSKB:4038777><MSKB:4038779><MSKB:4038781><MSKB:4038782><MSKB:4038783><MSKB:4038786><MSKB:4038788><MSKB:4038792><MSKB:4038793><MSKB:4038799><MSKB:4039384>,2,2,3.3,AV:L/AC:L/Au:N/C:P/I:N/A:N,Microsoft,Windows 7 Professional Edition,SP1
18,10.0.2.15,-1,-1,Microsoft CVE-2017-8677: Windows GDI+ Information Disclosure Vulnerability,77492,msft-cve-2017-8677,<CVE:CVE-2017-8677><MSKB:4038777><MSKB:4038779><MSKB:4038781><MSKB:4038782><MSKB:4038783><MSKB:4038786><MSKB:4038788><MSKB:4038792><MSKB:4038793><MSKB:4038799>,2,2,5.5,AV:L/AC:L/Au:N/C:P/I:N/A:N,Microsoft,Windows 7 Professional Edition,SP1
18,10.0.2.15,-1,-1,Microsoft CVE-2017-8678: Windows Kernel Information Disclosure Vulnerability,77494,msft-cve-2017-8678,<CVE:CVE-2017-8678><MSKB:4038777><MSKB:4038779><MSKB:4038781><MSKB:4038782><MSKB:4038783><MSKB:4038786><MSKB:4038788><MSKB:4038792><MSKB:4038793><MSKB:4038799><MSKB:4039384>,2,2,5.5,AV:L/AC:L/Au:N/C:P/I:N/A:N,Microsoft,Windows 7 Professional Edition,SP1
18,10.0.2.15,-1,-1,Microsoft CVE-2017-8679: Windows Kernel Information Disclosure Vulnerability,77500,msft-cve-2017-8679,<CVE:CVE-2017-8679><MSKB:4038777><MSKB:4038779><MSKB:4038781><MSKB:4038782><MSKB:4038783><MSKB:4038786><MSKB:4038788><MSKB:4038792><MSKB:4038793><MSKB:4038799><MSKB:4038874>,2,2,5.5,AV:L/AC:L/Au:N/C:P/I:N/A:N,Microsoft,Windows 7 Professional Edition,SP1
18,10.0.2.15,-1,-1,Microsoft CVE-2017-8680: Windows GDI+ Information Disclosure Vulnerability,77335,msft-cve-2017-8680,<CVE:CVE-2017-8680><MSKB:4038777><MSKB:4038779><MSKB:4038786><MSKB:4038792><MSKB:4038793><MSKB:4038799><MSKB:4039384>,2,2,5.5,AV:L/AC:L/Au:N/C:P/I:N/A:N,Microsoft,Windows 7 Professional Edition,SP1
18,10.0.2.15,-1,-1,Microsoft CVE-2017-8681: Windows GDI+ Information Disclosure Vulnerability,77336,msft-cve-2017-8681,<CVE:CVE-2017-8681><MSKB:4038777><MSKB:4038779><MSKB:4038781><MSKB:4038782><MSKB:4038783><MSKB:4038786><MSKB:4038788><MSKB:4038792><MSKB:4038793><MSKB:4038799><MSKB:4039384>,2,2,5.5,AV:L/AC:L/Au:N/C:P/I:N/A:N,Microsoft,Windows 7 Professional Edition,SP1
18,10.0.2.15,-1,-1,Microsoft CVE-2017-8682: Win32k Graphics Remote Code Execution Vulnerability,77345,msft-cve-2017-8682,<CVE:CVE-2017-8682><MSKB:3213638><MSKB:3213641><MSKB:4011134><MSKB:4038777><MSKB:4038779><MSKB:4038781><MSKB:4038782><MSKB:4038783><MSKB:4038786><MSKB:4038788><MSKB:4038792><MSKB:4038793><MSKB:4038799><MSKB:4039384>,9,5,8.8,AV:N/AC:M/Au:N/C:C/I:C/A:C,Microsoft,Windows 7 Professional Edition,SP1
18,10.0.2.15,-1,-1,Microsoft CVE-2017-8683: Microsoft Graphics Component Information Disclosure Vulnerability,77347,msft-cve-2017-8683,<CVE:CVE-2017-8683><MSKB:4038777><MSKB:4038779><MSKB:4038781><MSKB:4038782><MSKB:4038783><MSKB:4038786><MSKB:4038788><MSKB:4038792><MSKB:4038793><MSKB:4038799><MSKB:4039384>,2,2,5.5,AV:L/AC:L/Au:N/C:P/I:N/A:N,Microsoft,Windows 7 Professional Edition,SP1
18,10.0.2.15,-1,-1,Microsoft CVE-2017-8684: Windows GDI+ Information Disclosure Vulnerability,77341,msft-cve-2017-8684,<CVE:CVE-2017-8684><MSKB:4038777><MSKB:4038779><MSKB:4038786><MSKB:4038792><MSKB:4038793><MSKB:4038799><MSKB:4039384>,2,2,5.5,AV:L/AC:L/Au:N/C:P/I:N/A:N,Microsoft,Windows 7 Professional Edition,SP1
18,10.0.2.15,-1,-1,Microsoft CVE-2017-8685: Windows GDI+ Information Disclosure Vulnerability,77343,msft-cve-2017-8685,<CVE:CVE-2017-8685><MSKB:4038777><MSKB:4038779><MSKB:4039384>,2,2,5.5,AV:L/AC:L/Au:N/C:P/I:N/A:N,Microsoft,Windows 7 Professional Edition,SP1
